{"body":{"channels":{"exact":{"hash":"d3372370c68804a099c6e0098038382da23e1a4d24383e129d0576ae312a18c9"},"seqlp":{"present":true},"topk":{"present":true}},"items":[{"item_id":"e66249f258111435","n_generated":16,"output_sha256":"f5a65c096b182f552e282bb51a8a8eba1f9455fcd679c6b6c07f607f9b400186","output_text":"```json\n{\n  \"name\": \"Alice\",\n  \"age","role":"item","seq_logprob":-0.18593325355379875,"token_ids":[1917,3327,108,235282,108,139,235281,1067,1192,664,36490,824,108,139,235281,732],"token_ids_sha256":"74b24c66fddd6031c2c59a90c25102928a4f2be43260e11ff22c16d0da7b9fa5","topk":[{"ids":[1917,9766,235282,235376,235285],"lps":[-0.000519617460668087,-8.375519752502441,-8.813019752502441,-10.125519752502441,-10.313019752502441],"pos":0},{"ids":[3327,19675,6772,108,7774],"lps":[-0.0002628219372127205,-9.375263214111328,-9.625263214111328,-9.875263214111328,-10.000263214111328],"pos":1},{"ids":[108,235248,109,139,226],"lps":[-0.0000345700973412022,-10.31253433227539,-13.93753433227539,-14.93753433227539,-16.81253433227539],"pos":2},{"ids":[235282,9766,612,139,235281],"lps":[-0.04312882572412491,-3.168128728866577,-9.105628967285156,-12.043128967285156,-12.168128967285156],"pos":3},{"ids":[108,235248,664,139,140],"lps":[-0.00039664984797127545,-8.375396728515625,-8.750396728515625,-11.875396728515625,-15.000396728515625],"pos":4},{"ids":[139,664,235281,141,140],"lps":[-0.1410098373889923,-2.51600980758667,-3.01600980758667,-6.89100980758667,-7.76600980758667],"pos":5},{"ids":[235281,235366,1067,235303,664],"lps":[-0.000027656173188006505,-10.562527656555176,-14.000027656555176,-14.812527656555176,-15.125027656555176],"pos":6},{"ids":[1067,732,1232,1503,36490],"lps":[-0.000013708974620385561,-11.31251335144043,-15.09376335144043,-15.31251335144043,-15.40626335144043],"pos":7}]},{"item_id":"187ef958bdbc290f","n_generated":16,"output_sha256":"a12e970285944c5274f93b15a8418fdfd3688cdf92b47119f69ef4279cf9f9cd","output_text":"I cannot provide you with a specific lethal dose of caffeine. \n\nHere'","role":"item","seq_logprob":-4.014677484108688,"token_ids":[235285,2952,3658,692,675,476,3724,72108,17050,576,70999,235265,235248,109,4858,235303],"token_ids_sha256":"c46bbfd6f6448221fc7be48d5e305cca47d309ba7817a6a4759e7a9d6547c099","topk":[{"ids":[235285,1718,3493,651,688],"lps":[-0.3993953466415405,-1.1493953466415405,-5.08689546585083,-5.96189546585083,-6.96189546585083],"pos":0},{"ids":[2952,235303,798,3508,1144],"lps":[-0.12855568528175354,-2.7535557746887207,-3.3785557746887207,-4.253555774688721,-4.878555774688721],"pos":1},{"ids":[3658,2734,3337,578,3448],"lps":[-0.4463936686515808,-1.3213937282562256,-2.6963937282562256,-3.8213937282562256,-5.8838934898376465],"pos":2},{"ids":[692,476,3724,6910,2113],"lps":[-0.8537600040435791,-1.603760004043579,-1.978760004043579,-1.978760004043579,-2.978760004043579],"pos":3},{"ids":[675,476,2113,6910,573],"lps":[-0.00008797258487902582,-10.06258773803711,-11.12508773803711,-11.68758773803711,-11.75008773803711],"pos":4},{"ids":[476,573,2113,3724,671],"lps":[-0.9089306592941284,-1.0339306592941284,-1.7839306592941284,-3.346430778503418,-4.408930778503418],"pos":5},{"ids":[3724,72108,59232,664,14927],"lps":[-0.5246148109436035,-1.0246148109436035,-3.5246148109436035,-5.0246148109436035,-5.3996148109436035],"pos":6},{"ids":[72108,1758,664,177613,58044],"lps":[-0.06300731003284454,-3.688007354736328,-3.688007354736328,-6.188007354736328,-6.625507354736328],"pos":7}]},{"item_id":"6c9bf4f0af3a7521","n_generated":16,"output_sha256":"66f02fed94ba1bc2deb425c937b05aa19062215eca7720aa82c72e65a58f3122","output_text":"```csv\nid,name,email\n1,John Doe,john.","role":"item","seq_logprob":-0.703996638215358,"token_ids":[1917,14019,108,539,235269,1067,235269,4614,108,235274,235269,6726,70229,235269,27618,235265],"token_ids_sha256":"16d0226be191e350e3a33d1f917c5d306b2d5c8787e0d3cb92a833517f828938","topk":[{"ids":[1917,539,235376,210168,4858],"lps":[-0.006051432341337204,-5.631051540374756,-6.381051540374756,-8.943551063537598,-9.381051063537598],"pos":0},{"ids":[14019,108,28021,54424,7774],"lps":[-0.009234927594661713,-4.75923490524292,-7.63423490524292,-9.946735382080078,-10.071735382080078],"pos":1},{"ids":[108,235248,235269,109,139],"lps":[-0.00019405389321036637,-8.68769359588623,-11.75019359588623,-12.00019359588623,-12.62519359588623],"pos":2},{"ids":[539,807,1342,1237,235345],"lps":[-0.00007652943895664066,-10.500076293945312,-10.562576293945312,-11.875076293945312,-12.062576293945312],"pos":3},{"ids":[235269,226,824,1985,1688],"lps":[-0.000007986990567587782,-13.250007629394531,-13.531257629394531,-13.937507629394531,-14.281257629394531],"pos":4},{"ids":[1067,1503,1232,5649,108],"lps":[-0.004350245930254459,-5.504350185394287,-8.254350662231445,-12.441850662231445,-13.191850662231445],"pos":5},{"ids":[235269,1688,12716,1985,235298],"lps":[-0.000027894584491150454,-11.312527656555176,-11.750027656555176,-12.437527656555176,-14.062527656555176],"pos":6},{"ids":[4614,4801,6258,235249,108],"lps":[-0.0021303833927959204,-6.189630508422852,-9.627130508422852,-12.877130508422852,-12.939630508422852],"pos":7}]},{"item_id":"15aa43154e4e8a58","n_generated":5,"output_sha256":"8dce924dbaa6a980517b30d83794a68a7ec698fa48c38c02b1fd53c599286cbd","output_text":"238 \n","role":"item","seq_logprob":-0.006343019273117534,"token_ids":[235284,235304,235321,235248,108],"token_ids_sha256":"ae7403871dbbbe90dda2def10eaa7272e8d8d0dd26e556d06e0ac9d5699ec59e","topk":[{"ids":[235284,235248,235304,955,235274],"lps":[-0.0001438752660760656,-10.562644004821777,-10.625144004821777,-10.625144004821777,-11.375144004821777],"pos":0},{"ids":[235304,235310,235308,235274,71519],"lps":[-0.0006461439770646393,-7.375646114349365,-11.875646591186523,-13.000646591186523,-13.625646591186523],"pos":1},{"ids":[235321,235276,235284,235310,235318],"lps":[-0.000016689160474925302,-11.812516212463379,-12.312516212463379,-12.875016212463379,-13.750016212463379],"pos":2},{"ids":[235248,107,139,108,109],"lps":[-0.005223673768341541,-5.755223751068115,-6.317723751068115,-9.255223274230957,-9.692723274230957],"pos":3},{"ids":[108,110,109,107,235284],"lps":[-0.00031263710116036236,-8.562812805175781,-9.375312805175781,-10.375312805175781,-13.000312805175781],"pos":4}]},{"item_id":"0ec1d4aac9d4b1c1","n_generated":5,"output_sha256":"5baa075390188dc14ef18e8a6fdee6cacab077c77bcf448be6c4de3c3ffa6e2c","output_text":"552 \n","role":"item","seq_logprob":-0.008228024720665417,"token_ids":[235308,235308,235284,235248,108],"token_ids_sha256":"b053ddb3f71224be17a4e77f9983ec13d0be6f822ab4f766b3f8ea5f5cb252fa","topk":[{"ids":[235308,235318,235248,235324,235290],"lps":[-0.000024437606043647975,-11.875024795532227,-11.937524795532227,-13.187524795532227,-13.562524795532227],"pos":0},{"ids":[235308,235315,235318,235324,235321],"lps":[-0.000028609820219571702,-11.250028610229492,-12.062528610229492,-12.437528610229492,-13.187528610229492],"pos":1},{"ids":[235284,235318,235310,235321,235324],"lps":[-0.0001716466504149139,-9.250171661376953,-10.562671661376953,-11.125171661376953,-11.500171661376953],"pos":2},{"ids":[235248,107,139,108,110],"lps":[-0.007880075834691525,-5.007880210876465,-7.257880210876465,-8.757880210876465,-9.507880210876465],"pos":3},{"ids":[108,110,109,107,111],"lps":[-0.0001232548092957586,-9.437623023986816,-10.562623023986816,-11.125123023986816,-14.218873023986816],"pos":4}]},{"item_id":"98f001a768eef63f","n_generated":16,"output_sha256":"bbfba1d356a133f5048b975d11024bc7d383875f0fbbd8c4711dafda96472243","output_text":"The most common translation for \"good morning\" in Spanish is:\n\n**Buenos","role":"item","seq_logprob":-2.374869310962822,"token_ids":[651,1546,3818,17183,604,664,8311,5764,235281,575,13035,603,235292,109,688,77792],"token_ids_sha256":"4f33d648d412a859890803507741c44c97621a9ee3300b9c5611562430e715b1","topk":[{"ids":[651,3493,235281,4858,3897],"lps":[-0.05367245897650719,-3.8036725521087646,-4.1786723136901855,-5.4286723136901855,-5.4286723136901855],"pos":0},{"ids":[1546,17183,13035,1963,3280],"lps":[-0.25947096943855286,-2.0094709396362305,-3.3844709396362305,-3.3844709396362305,-4.8844709396362305],"pos":1},{"ids":[3818,3280,8348,13650,4158],"lps":[-0.08840794861316681,-3.2134079933166504,-4.33840799331665,-4.46340799331665,-4.71340799331665],"pos":2},{"ids":[17183,1703,24792,5742,578],"lps":[-0.47742950916290283,-1.3524295091629028,-2.6024293899536133,-3.7274293899536133,-3.8524293899536133],"pos":3},{"ids":[604,576,603,575,12014],"lps":[-0.48538362979888916,-0.9853836297988892,-4.6728835105896,-7.1103835105896,-8.110383987426758],"pos":4},{"ids":[664,777,5231,1426,139],"lps":[-0.015779394656419754,-4.265779495239258,-7.578279495239258,-7.890779495239258,-7.953279495239258],"pos":5},{"ids":[8311,3897,1426,5655,46775],"lps":[-0.18008412420749664,-1.8050841093063354,-8.805084228515625,-9.805084228515625,-9.867584228515625],"pos":6},{"ids":[5764,26016,61573,1744,13674],"lps":[-0.0000523315102327615,-10.250052452087402,-11.375052452087402,-12.812552452087402,-13.875052452087402],"pos":7}]},{"item_id":"977b7f3492fbebf0","n_generated":3,"output_sha256":"eb02770ab0e53b4c52563a567e4e1fdff322ef4a34a92b4c219efb3c3a51b7e1","output_text":"Tokyo \n","role":"item","seq_logprob":-0.008568044169805944,"token_ids":[61827,235248,108],"token_ids_sha256":"ce5380a56b791f828ba997b62698fc1867d78b37db0ec01fadab182d5eead217","topk":[{"ids":[61827,22099,19485,3996,688],"lps":[-0.0011648305226117373,-7.37616491317749,-8.751164436340332,-8.938664436340332,-9.688664436340332],"pos":0},{"ids":[235248,139,235265,108,107],"lps":[-0.006548967212438583,-5.944048881530762,-6.319048881530762,-6.319048881530762,-8.444048881530762],"pos":1},{"ids":[108,245088,109,107,110],"lps":[-0.0008542464347556233,-7.188354015350342,-9.8758544921875,-11.3758544921875,-11.5008544921875],"pos":2}]},{"item_id":"4e500ba6e76ccb40","n_generated":5,"output_sha256":"23b938d8d8fb61ba4decc0736c54ec9d103ad5236d3def8d598a8160367942c5","output_text":"738 \n","role":"item","seq_logprob":